Example,Reference Summary,Base Output,LoRA Output
1,"The paper investigates retrieval-augmented generation with structured prompting and finds that it improves phrase-level overlap with reference summaries, although long inputs require truncation.",A method for retrieval-augmented generation of large language models is based on a novel approach to the use of long inputs. The results indicate that the method improves phrase-level overlap with reference summaries.,"This work uses structured prompting to improve retrieval-augmented generation, showing that it improves phrase-level overlap with reference summaries, and shows that long inputs require truncation."
2,"This work applies human-in-the-loop error analysis to domain adaptation, demonstrating improved summarization behavior despite the limitation that performance remains limited by dataset size.","Human-in-the-loop error analysis can support domain adaptation in a wide range of contexts, including:","This study investigates domain adaptation using human-in-the-loop error analysis, showing that it improves alignment between generated and reference summaries, while noting that performance remains limited by dataset size."
3,"The research addresses model calibration using section-wise document encoding, with results showing that it improves phrase-level overlap with reference summaries.",A method for encoding document encoders is used to evaluate the use of section-wise document ecoding.,"This study uses section-wise document encoding to improve model calibration, showing that it improves phrase-level overlap with reference summaries, and shows that long inputs require truncation."
4,"The research addresses attention-based summarization using structured prompting, with results showing that it produces more concise and structured summaries.",Summarization metrics and qualitative analysis of generated outputs demonstrate that the method produces more concise and structured summaries. The main limitation is that some outputs remain overly generic.,"This study investigates structured prompting with attention-based summarization, showing that it produces more concise and structured summaries, although some outputs remain overly generic."
5,"This study uses attention-based sequence-to-sequence modeling to improve document-level generation, showing that the approach reduces hallucinated claims while noting that long inputs require truncation.",This study focuses on document-level generation and evaluates attention-based sequence-to-sequence modeling as a practical solution.,"This study uses attention-based sequence-to-sequence modeling to reduce hallucinated claims, showing that it reduces hallucinous claims while noting that long inputs require truncation."
